id,listing_url,last_scraped,name,host_id,host_url,host,neighbourhood,neighbourhood_cleansed,neighbourhood_group_cleansed,latitude,longitude,property_type,room_type,accommodates,bedrooms,beds,price,minimum_nights,maximum_nights,minimum_minimum_nights,has_availability,availability_30,availability_60,availability_90,availability_365,number_of_reviews,license,instant_bookable,host_alias,alias_id,status,ISD_status,ISD_address,ISD_category,license_listing_count,license_cat_max_exceed,simple_status,full_status,other_hosts,cluster,centroid_group_recognized,centroid_group_change_pct_listings,centroid_group_distance,sub_centroid,sub_centroid_distance,color,high_confidence
39056629,https://www.airbnb.com/rooms/39056629,2020-09-01,Spacious Designed Private Room Close to Downtown,299340250,https://www.airbnb.com/users/show/299340250,Teresa & Jonathan,"Boston, Massachusetts, United States",Roxbury,,42.3232,-71.06881,Private room in apartment,Private room,1,1.0,1.0,50.0,28,1125,28.0,t,18,22,37,299,5,Missing,f,,,No license claimed,,,,,,No license claimed,No license claimed,,52-1,True,0.0,210.8225581123373,,,#FF9800,
39199659,https://www.airbnb.com/rooms/39199659,2020-09-01,Private Designed Bedroom Long Term by Downtown,299340250,https://www.airbnb.com/users/show/299340250,Teresa & Jonathan,"Boston, Massachusetts, United States",Roxbury,,42.32397,-71.06857,Private room in apartment,Private room,1,1.0,1.0,39.0,28,1125,28.0,t,20,20,20,265,3,Missing,f,,,No license claimed,,,,,,No license claimed,No license claimed,,52-1,True,0.0,180.0927732625481,,,#FF9800,
39700598,https://www.airbnb.com/rooms/39700598,2020-09-01,Fully Furnished Long Term Bedroom by Downtown,299340250,https://www.airbnb.com/users/show/299340250,Teresa & Jonathan,"Boston, Massachusetts, United States",Roxbury,,42.32248,-71.07072,Private room in apartment,Private room,1,1.0,1.0,39.0,28,1125,28.0,t,0,0,0,244,0,Missing,f,,,No license claimed,,,,,,No license claimed,No license claimed,,,,,,,,#FF9800,
41624190,https://www.airbnb.com/rooms/41624190,2020-09-01,Spacious 1st Floor Private Room Close to Downtown,299340250,https://www.airbnb.com/users/show/299340250,Teresa & Jonathan,"Boston, Massachusetts, United States",Roxbury,,42.32362,-71.06923,Private room in apartment,Private room,1,1.0,1.0,39.0,28,1125,28.0,t,0,19,49,324,0,Missing,f,,,No license claimed,,,,,,No license claimed,No license claimed,,52-1,True,0.0,43.564128714368536,,,#FF9800,
42591679,https://www.airbnb.com/rooms/42591679,2020-09-01,Designed 1st Floor Furnished Bedroom by Downtown,299340250,https://www.airbnb.com/users/show/299340250,Teresa & Jonathan,"Boston, Massachusetts, United States",Roxbury,,42.32388,-71.06985999999998,Private room in apartment,Private room,1,1.0,1.0,39.0,28,1125,28.0,t,0,0,10,74,1,Missing,f,,,No license claimed,,,,,,No license claimed,No license claimed,,52-1,True,0.0,201.495025664738,,,#FF9800,
42592642,https://www.airbnb.com/rooms/42592642,2020-09-01,Garden 1st Floor Furnished Bedroom,299340250,https://www.airbnb.com/users/show/299340250,Teresa & Jonathan,"Boston, Massachusetts, United States",Roxbury,,42.32394,-71.06926,Private room in apartment,Private room,1,1.0,1.0,39.0,28,1125,28.0,t,0,0,0,0,1,Missing,f,,,No license claimed,,,,,,No license claimed,No license claimed,,52-1,True,0.0,85.21887285433084,,,#FF9800,
43085606,https://www.airbnb.com/rooms/43085606,2020-09-01,Triple Decker Private Apartment Close to Downtown,299340250,https://www.airbnb.com/users/show/299340250,Teresa & Jonathan,"Boston, Massachusetts, United States",Roxbury,,42.32453,-71.06742,Entire apartment,Entire home/apt,3,3.0,3.0,135.0,28,1125,28.0,t,0,0,10,73,0,Missing,f,,,No license claimed,,,,,,No license claimed,No license claimed,,,,,,,,#FF9800,
43087326,https://www.airbnb.com/rooms/43087326,2020-09-01,Triple Decker 3 Bed Apartment Close to Downtown,299340250,https://www.airbnb.com/users/show/299340250,Teresa & Jonathan,"Boston, Massachusetts, United States",Roxbury,,42.32259000000001,-71.06778,Entire apartment,Entire home/apt,3,4.0,4.0,135.0,28,1125,28.0,t,0,0,0,243,0,Missing,f,,,No license claimed,,,,,,No license claimed,No license claimed,,,,,,,,#FF9800,
